{
  "kind": "probe-receipt",
  "version": "1.0.0",
  "toolId": "github-cli",
  "state": "EXECUTED",
  "probeTimestamp": "2026-09-09T10:00:00Z",
  "summary": "Historical authenticated repository read succeeded.",
  "inputContract": "Authenticated GitHub read command.",
  "outputContract": "Command success/failure plus repository-readable output.",
  "evidence": {
    "location": "docs/data/receipts.json#receipt-github-auth-write",
    "hashStatus": "measured",
    "sha256": "aaaaaaaaaaaaaaaaaaaaaaaaaaaaaaaaaaaaaaaaaaaaaaaaaaaaaaaaaaaaaaaa"
  },
  "result": {
    "classification": "DETECTED",
    "exitCode": 0
  },
  "review": {
    "verified": false,
    "reviewer": null
  }
}
