{
  "kind": "probe-receipt",
  "version": "1.0.0",
  "toolId": "github-cli",
  "state": "EXECUTED",
  "probeTimestamp": "2026-02-30T15:01:28Z",
  "summary": "Invalid timestamps must be rejected.",
  "inputContract": "Authenticated GitHub read command.",
  "outputContract": "Command success/failure plus repository-readable output.",
  "evidence": {
    "location": "external-receipt://github-cli/windows-read",
    "hashStatus": "measured",
    "sha256": "dddddddddddddddddddddddddddddddddddddddddddddddddddddddddddddddd"
  },
  "result": {
    "classification": "DETECTED",
    "exitCode": 0
  },
  "review": {
    "verified": false,
    "reviewer": null
  }
}
