{
  "kind": "probe-receipt",
  "version": "1.0.0",
  "toolId": "smarts-bio",
  "state": "PROBED",
  "probeTimestamp": "2026-09-09T10:05:00Z",
  "summary": "Synthetic response noted but payload hashing was not available.",
  "inputContract": "Catalogue browse or named tool execution request.",
  "outputContract": "Catalogue entries, tool execution receipt, or explicit no-execution reply.",
  "evidence": {
    "location": "tests/fixtures/software-only-note.txt",
    "hashStatus": "not_measured",
    "sha256": null
  },
  "result": {
    "classification": "UNKNOWN",
    "exitCode": 404
  },
  "review": {
    "verified": false,
    "reviewer": null
  }
}
